name,rating,review,colour,date,title,rating_score,date_parsed,language,cleaned_text,tokens,token_count,sentences,sentence_count,tokens_no_stopwords,lemmatized_tokens,lemmatized_text
Panna Roy,3.0 out of 5 stars,"Hello,I recently received a Fastrack watch, but the screen appears to be slightly tilted/misaligned. It doesn’t look properly aligned inside the case. Please help me with a replacement or refund.Thank you.",Rose Gold,8 October 2025,Screen is misaligned,3.0,2025-10-08,en,"hello,i recently received a fastrack watch, but the screen appears to be slightly tiltedmisaligned. it doesnt look properly aligned inside the case. please help me with a replacement or refund.thank you.","['hello', ',', 'i', 'recently', 'received', 'a', 'fastrack', 'watch', ',', 'but', 'the', 'screen', 'appears', 'to', 'be', 'slightly', 'tiltedmisaligned', '.', 'it', 'doesnt', 'look', 'properly', 'aligned', 'inside', 'the', 'case', '.', 'please', 'help', 'me', 'with', 'a', 'replacement', 'or', 'refund.thank', 'you', '.']",37,"['hello,i recently received a fastrack watch, but the screen appears to be slightly tiltedmisaligned.', 'it doesnt look properly aligned inside the case.', 'please help me with a replacement or refund.thank you.']",3,"['hello', ',', 'recently', 'received', 'fastrack', 'watch', ',', 'screen', 'appears', 'slightly', 'tiltedmisaligned', '.', 'doesnt', 'look', 'properly', 'aligned', 'inside', 'case', '.', 'please', 'help', 'replacement', 'refund.thank', '.']","['hello', ',', 'recently', 'received', 'fastrack', 'watch', ',', 'screen', 'appears', 'slightly', 'tiltedmisaligned', '.', 'doesnt', 'look', 'properly', 'aligned', 'inside', 'case', '.', 'please', 'help', 'replacement', 'refund.thank', '.']","hello , recently received fastrack watch , screen appears slightly tiltedmisaligned . doesnt look properly aligned inside case . please help replacement refund.thank ."
Venkata,4.0 out of 5 stars,"Belt Chain is very heavy, people who likes heavy belt can enjoy this. I have changed belt to light weight. After buying it only one time it was worked and after that charger not working. I went to fast-track store they took time but replaced it. Now it is working fine.",Black_Metal,26 August 2025,Good watch,4.0,2025-08-26,en,"belt chain is very heavy, people who likes heavy belt can enjoy this. i have changed belt to light weight. after buying it only one time it was worked and after that charger not working. i went to fasttrack store they took time but replaced it. now it is working fine.","['belt', 'chain', 'is', 'very', 'heavy', ',', 'people', 'who', 'likes', 'heavy', 'belt', 'can', 'enjoy', 'this', '.', 'i', 'have', 'changed', 'belt', 'to', 'light', 'weight', '.', 'after', 'buying', 'it', 'only', 'one', 'time', 'it', 'was', 'worked', 'and', 'after', 'that', 'charger', 'not', 'working', '.', 'i', 'went', 'to', 'fasttrack', 'store', 'they', 'took', 'time', 'but', 'replaced', 'it', '.', 'now', 'it', 'is', 'working', 'fine', '.']",57,"['belt chain is very heavy, people who likes heavy belt can enjoy this.', 'i have changed belt to light weight.', 'after buying it only one time it was worked and after that charger not working.', 'i went to fasttrack store they took time but replaced it.', 'now it is working fine.']",5,"['belt', 'chain', 'heavy', ',', 'people', 'likes', 'heavy', 'belt', 'enjoy', '.', 'changed', 'belt', 'light', 'weight', '.', 'buying', 'one', 'time', 'worked', 'charger', 'working', '.', 'went', 'fasttrack', 'store', 'took', 'time', 'replaced', '.', 'working', 'fine', '.']","['belt', 'chain', 'heavy', ',', 'people', 'like', 'heavy', 'belt', 'enjoy', '.', 'changed', 'belt', 'light', 'weight', '.', 'buying', 'one', 'time', 'worked', 'charger', 'working', '.', 'went', 'fasttrack', 'store', 'took', 'time', 'replaced', '.', 'working', 'fine', '.']","belt chain heavy , people like heavy belt enjoy . changed belt light weight . buying one time worked charger working . went fasttrack store took time replaced . working fine ."
Happy with this product,3.0 out of 5 stars,I face hanging problem in this watch how can I fix it?,Rose Gold Mesh,18 October 2025,Hanging issues,3.0,2025-10-18,en,i face hanging problem in this watch how can i fix it?,"['i', 'face', 'hanging', 'problem', 'in', 'this', 'watch', 'how', 'can', 'i', 'fix', 'it', '?']",13,['i face hanging problem in this watch how can i fix it?'],1,"['face', 'hanging', 'problem', 'watch', 'fix', '?']","['face', 'hanging', 'problem', 'watch', 'fix', '?']",face hanging problem watch fix ?
Ashish solanki,5.0 out of 5 stars,The watch is looking great display is smooth overall it is worth buying.,Charcoal Black,5 November 2025,Experience of using watch,5.0,2025-11-05,en,the watch is looking great display is smooth overall it is worth buying.,"['the', 'watch', 'is', 'looking', 'great', 'display', 'is', 'smooth', 'overall', 'it', 'is', 'worth', 'buying', '.']",14,['the watch is looking great display is smooth overall it is worth buying.'],1,"['watch', 'looking', 'great', 'display', 'smooth', 'overall', 'worth', 'buying', '.']","['watch', 'looking', 'great', 'display', 'smooth', 'overall', 'worth', 'buying', '.']",watch looking great display smooth overall worth buying .
karthikeyan.B,3.0 out of 5 stars,Product looks neat and GUI looks good and clean compared to boat but touch response is not good as boat brand,Carbon Black,2 October 2025,GUI is good but touch response is slow,3.0,2025-10-02,en,product looks neat and gui looks good and clean compared to boat but touch response is not good as boat brand,"['product', 'looks', 'neat', 'and', 'gui', 'looks', 'good', 'and', 'clean', 'compared', 'to', 'boat', 'but', 'touch', 'response', 'is', 'not', 'good', 'as', 'boat', 'brand']",21,['product looks neat and gui looks good and clean compared to boat but touch response is not good as boat brand'],1,"['product', 'looks', 'neat', 'gui', 'looks', 'good', 'clean', 'compared', 'boat', 'touch', 'response', 'good', 'boat', 'brand']","['product', 'look', 'neat', 'gui', 'look', 'good', 'clean', 'compared', 'boat', 'touch', 'response', 'good', 'boat', 'brand']",product look neat gui look good clean compared boat touch response good boat brand
Chanchal,3.0 out of 5 stars,Product is ok but charger is missing,Rose Gold Mesh,10 October 2025,Good product but charger missing,3.0,2025-10-10,en,product is ok but charger is missing,"['product', 'is', 'ok', 'but', 'charger', 'is', 'missing']",7,['product is ok but charger is missing'],1,"['product', 'ok', 'charger', 'missing']","['product', 'ok', 'charger', 'missing']",product ok charger missing
NEELAY RAJ,4.0 out of 5 stars,"Excellent Product, Hardware is fine but the fasttrack smart world app firmware is not updating.",Teal Green,19 August 2025,Great hardware but software app is faulty,4.0,2025-08-19,en,"excellent product, hardware is fine but the fasttrack smart world app firmware is not updating.","['excellent', 'product', ',', 'hardware', 'is', 'fine', 'but', 'the', 'fasttrack', 'smart', 'world', 'app', 'firmware', 'is', 'not', 'updating', '.']",17,"['excellent product, hardware is fine but the fasttrack smart world app firmware is not updating.']",1,"['excellent', 'product', ',', 'hardware', 'fine', 'fasttrack', 'smart', 'world', 'app', 'firmware', 'updating', '.']","['excellent', 'product', ',', 'hardware', 'fine', 'fasttrack', 'smart', 'world', 'app', 'firmware', 'updating', '.']","excellent product , hardware fine fasttrack smart world app firmware updating ."
Rajesh devarapalli,3.0 out of 5 stars,"I have return this item, but still amount is not refunded",BLUE,4 October 2025,Not looking good,3.0,2025-10-04,en,"i have return this item, but still amount is not refunded","['i', 'have', 'return', 'this', 'item', ',', 'but', 'still', 'amount', 'is', 'not', 'refunded']",12,"['i have return this item, but still amount is not refunded']",1,"['return', 'item', ',', 'still', 'amount', 'refunded']","['return', 'item', ',', 'still', 'amount', 'refunded']","return item , still amount refunded"
Simrah,5.0 out of 5 stars,Very nice watchIf one is looking for a smartwatch this is the one I would recommend,Charcoal Black,27 October 2025,It’s quality is amazing,5.0,2025-10-27,en,very nice watchif one is looking for a smartwatch this is the one i would recommend,"['very', 'nice', 'watchif', 'one', 'is', 'looking', 'for', 'a', 'smartwatch', 'this', 'is', 'the', 'one', 'i', 'would', 'recommend']",16,['very nice watchif one is looking for a smartwatch this is the one i would recommend'],1,"['nice', 'watchif', 'one', 'looking', 'smartwatch', 'one', 'would', 'recommend']","['nice', 'watchif', 'one', 'looking', 'smartwatch', 'one', 'would', 'recommend']",nice watchif one looking smartwatch one would recommend
Prashant,4.0 out of 5 stars,Good in this price range,Teal_RoseGold,22 August 2025,Value for money,4.0,2025-08-22,en,good in this price range,"['good', 'in', 'this', 'price', 'range']",5,['good in this price range'],1,"['good', 'price', 'range']","['good', 'price', 'range']",good price range
s. iyappan,4.0 out of 5 stars,Good product my son like this product c,BLUE,19 August 2025,Good,4.0,2025-08-19,en,good product my son like this product c,"['good', 'product', 'my', 'son', 'like', 'this', 'product', 'c']",8,['good product my son like this product c'],1,"['good', 'product', 'son', 'like', 'product', 'c']","['good', 'product', 'son', 'like', 'product', 'c']",good product son like product c
KM GEORGE,5.0 out of 5 stars,"Nice watch . For those who are having small wrist ,small size ie 1.83'' like that can be purchased.",Charcoal Black,26 October 2025,Good digital watch.,5.0,2025-10-26,en,"nice watch . for those who are having small wrist ,small size ie 1.83 like that can be purchased.","['nice', 'watch', '.', 'for', 'those', 'who', 'are', 'having', 'small', 'wrist', ',', 'small', 'size', 'ie', '1.83', 'like', 'that', 'can', 'be', 'purchased', '.']",21,"['nice watch .', 'for those who are having small wrist ,small size ie 1.83 like that can be purchased.']",2,"['nice', 'watch', '.', 'small', 'wrist', ',', 'small', 'size', 'ie', '1.83', 'like', 'purchased', '.']","['nice', 'watch', '.', 'small', 'wrist', ',', 'small', 'size', 'ie', '1.83', 'like', 'purchased', '.']","nice watch . small wrist , small size ie 1.83 like purchased ."
Dileep,5.0 out of 5 stars,Very good product,Beige,6 November 2025,Good product,5.0,2025-11-06,en,very good product,"['very', 'good', 'product']",3,['very good product'],1,"['good', 'product']","['good', 'product']",good product
G shares,3.0 out of 5 stars,Decent product. Does its work.It doesn't feel premium neither cheap. Does exact for the price paid.I would recommend if its the maximum budget you have to buy a smart watch,Charcoal Black,17 September 2025,Average product for average price,3.0,2025-09-17,en,decent product. does its work.it doesnt feel premium neither cheap. does exact for the price paid.i would recommend if its the maximum budget you have to buy a smart watch,"['decent', 'product', '.', 'does', 'its', 'work.it', 'doesnt', 'feel', 'premium', 'neither', 'cheap', '.', 'does', 'exact', 'for', 'the', 'price', 'paid.i', 'would', 'recommend', 'if', 'its', 'the', 'maximum', 'budget', 'you', 'have', 'to', 'buy', 'a', 'smart', 'watch']",32,"['decent product.', 'does its work.it doesnt feel premium neither cheap.', 'does exact for the price paid.i would recommend if its the maximum budget you have to buy a smart watch']",3,"['decent', 'product', '.', 'work.it', 'doesnt', 'feel', 'premium', 'neither', 'cheap', '.', 'exact', 'price', 'paid.i', 'would', 'recommend', 'maximum', 'budget', 'buy', 'smart', 'watch']","['decent', 'product', '.', 'work.it', 'doesnt', 'feel', 'premium', 'neither', 'cheap', '.', 'exact', 'price', 'paid.i', 'would', 'recommend', 'maximum', 'budget', 'buy', 'smart', 'watch']",decent product . work.it doesnt feel premium neither cheap . exact price paid.i would recommend maximum budget buy smart watch
Nithya devi Natarajan,5.0 out of 5 stars,Nice fully satisfied,Black_Metal,5 November 2025,Good,5.0,2025-11-05,en,nice fully satisfied,"['nice', 'fully', 'satisfied']",3,['nice fully satisfied'],1,"['nice', 'fully', 'satisfied']","['nice', 'fully', 'satisfied']",nice fully satisfied
Kinnary Dwarkesh,4.0 out of 5 stars,"Connectivity is weak, gets disconnected easily. I purchased it to track swimming, which claimed as one of the sports mode, but it does not. Overall if you are look for style and basic fuctions then its nice.",Teal Green,31 July 2025,Good,4.0,2025-07-31,en,"connectivity is weak, gets disconnected easily. i purchased it to track swimming, which claimed as one of the sports mode, but it does not. overall if you are look for style and basic fuctions then its nice.","['connectivity', 'is', 'weak', ',', 'gets', 'disconnected', 'easily', '.', 'i', 'purchased', 'it', 'to', 'track', 'swimming', ',', 'which', 'claimed', 'as', 'one', 'of', 'the', 'sports', 'mode', ',', 'but', 'it', 'does', 'not', '.', 'overall', 'if', 'you', 'are', 'look', 'for', 'style', 'and', 'basic', 'fuctions', 'then', 'its', 'nice', '.']",43,"['connectivity is weak, gets disconnected easily.', 'i purchased it to track swimming, which claimed as one of the sports mode, but it does not.', 'overall if you are look for style and basic fuctions then its nice.']",3,"['connectivity', 'weak', ',', 'gets', 'disconnected', 'easily', '.', 'purchased', 'track', 'swimming', ',', 'claimed', 'one', 'sports', 'mode', ',', '.', 'overall', 'look', 'style', 'basic', 'fuctions', 'nice', '.']","['connectivity', 'weak', ',', 'get', 'disconnected', 'easily', '.', 'purchased', 'track', 'swimming', ',', 'claimed', 'one', 'sport', 'mode', ',', '.', 'overall', 'look', 'style', 'basic', 'fuctions', 'nice', '.']","connectivity weak , get disconnected easily . purchased track swimming , claimed one sport mode , . overall look style basic fuctions nice ."
Savita Sutar,5.0 out of 5 stars,Product is very good 👍👍👍,Blue,2 November 2025,Best,5.0,2025-11-02,en,product is very good,"['product', 'is', 'very', 'good']",4,['product is very good'],1,"['product', 'good']","['product', 'good']",product good
Krishnamurthy,4.0 out of 5 stars,"Not getting whatsapp or sms notification when paired with iphoneElse look wise am liking it alotWith such a nice old display, video player is missing feature in this.",Black_Metal,1 August 2025,Good watch with lot of scope for improvement,4.0,2025-08-01,en,"not getting whatsapp or sms notification when paired with iphoneelse look wise am liking it alotwith such a nice old display, video player is missing feature in this.","['not', 'getting', 'whatsapp', 'or', 'sms', 'notification', 'when', 'paired', 'with', 'iphoneelse', 'look', 'wise', 'am', 'liking', 'it', 'alotwith', 'such', 'a', 'nice', 'old', 'display', ',', 'video', 'player', 'is', 'missing', 'feature', 'in', 'this', '.']",30,"['not getting whatsapp or sms notification when paired with iphoneelse look wise am liking it alotwith such a nice old display, video player is missing feature in this.']",1,"['getting', 'whatsapp', 'sms', 'notification', 'paired', 'iphoneelse', 'look', 'wise', 'liking', 'alotwith', 'nice', 'old', 'display', ',', 'video', 'player', 'missing', 'feature', '.']","['getting', 'whatsapp', 'sm', 'notification', 'paired', 'iphoneelse', 'look', 'wise', 'liking', 'alotwith', 'nice', 'old', 'display', ',', 'video', 'player', 'missing', 'feature', '.']","getting whatsapp sm notification paired iphoneelse look wise liking alotwith nice old display , video player missing feature ."
Abhijot Dharwal,5.0 out of 5 stars,acha ha,Jet Black,4 November 2025,,5.0,2025-11-04,sw,acha ha,"['acha', 'ha']",2,['acha ha'],1,"['acha', 'ha']","['acha', 'ha']",acha ha
Shaikhasanuddin,5.0 out of 5 stars,Good product good quality good serves,Rose Gold Mesh,2 November 2025,Good amazon,5.0,2025-11-02,en,good product good quality good serves,"['good', 'product', 'good', 'quality', 'good', 'serves']",6,['good product good quality good serves'],1,"['good', 'product', 'good', 'quality', 'good', 'serves']","['good', 'product', 'good', 'quality', 'good', 'serf']",good product good quality good serf
Anbarasan,5.0 out of 5 stars,Worst it's not working after some days,Carbon Black,29 October 2025,Worst it's not working after some days,5.0,2025-10-29,en,worst its not working after some days,"['worst', 'its', 'not', 'working', 'after', 'some', 'days']",7,['worst its not working after some days'],1,"['worst', 'working', 'days']","['worst', 'working', 'day']",worst working day
Yesh,4.0 out of 5 stars,"Nice, value for money",Teal Green,19 August 2025,Nice,4.0,2025-08-19,en,"nice, value for money","['nice', ',', 'value', 'for', 'money']",5,"['nice, value for money']",1,"['nice', ',', 'value', 'money']","['nice', ',', 'value', 'money']","nice , value money"
Prasad shetty,3.0 out of 5 stars,Heart rate monitor stopped working after a week of purchase,Rose_Gold,23 September 2025,Sensor not working,3.0,2025-09-23,en,heart rate monitor stopped working after a week of purchase,"['heart', 'rate', 'monitor', 'stopped', 'working', 'after', 'a', 'week', 'of', 'purchase']",10,['heart rate monitor stopped working after a week of purchase'],1,"['heart', 'rate', 'monitor', 'stopped', 'working', 'week', 'purchase']","['heart', 'rate', 'monitor', 'stopped', 'working', 'week', 'purchase']",heart rate monitor stopped working week purchase
Md Mohin,5.0 out of 5 stars,Great product Love it,Dark Teal,30 October 2025,Fastrack revoltt fs1 pro vs fastrack revoltt fs2 pro was no difference fs2 is better,5.0,2025-10-30,en,great product love it,"['great', 'product', 'love', 'it']",4,['great product love it'],1,"['great', 'product', 'love']","['great', 'product', 'love']",great product love
Krishan murari,5.0 out of 5 stars,Nice watch,Silver Metal,31 October 2025,10,5.0,2025-10-31,en,nice watch,"['nice', 'watch']",2,['nice watch'],1,"['nice', 'watch']","['nice', 'watch']",nice watch
wajid,5.0 out of 5 stars,Awesome product 🥰,Black_Metal,30 October 2025,Special gift,5.0,2025-10-30,en,awesome product,"['awesome', 'product']",2,['awesome product'],1,"['awesome', 'product']","['awesome', 'product']",awesome product
KK Nair,5.0 out of 5 stars,Nice watch from Fastrack... My niece loves it.,Black_Metal,5 November 2025,Astor FR2 Pro,5.0,2025-11-05,en,nice watch from fastrack... my niece loves it.,"['nice', 'watch', 'from', 'fastrack', '...', 'my', 'niece', 'loves', 'it', '.']",10,['nice watch from fastrack... my niece loves it.'],1,"['nice', 'watch', 'fastrack', '...', 'niece', 'loves', '.']","['nice', 'watch', 'fastrack', '...', 'niece', 'love', '.']",nice watch fastrack ... niece love .
almas farheen,5.0 out of 5 stars,"Stylish , nice design",Black_Metal,27 October 2025,Fasttract never disappoint us one of the best product,5.0,2025-10-27,en,"stylish , nice design","['stylish', ',', 'nice', 'design']",4,"['stylish , nice design']",1,"['stylish', ',', 'nice', 'design']","['stylish', ',', 'nice', 'design']","stylish , nice design"
Tharakeswara,4.0 out of 5 stars,Nice and comfortable daily use,TEAL,6 August 2025,Fastrack,4.0,2025-08-06,en,nice and comfortable daily use,"['nice', 'and', 'comfortable', 'daily', 'use']",5,['nice and comfortable daily use'],1,"['nice', 'comfortable', 'daily', 'use']","['nice', 'comfortable', 'daily', 'use']",nice comfortable daily use
Rakesh L,5.0 out of 5 stars,Good. Value for money,Smoke,24 October 2025,Value for money,5.0,2025-10-24,en,good. value for money,"['good', '.', 'value', 'for', 'money']",5,"['good.', 'value for money']",2,"['good', '.', 'value', 'money']","['good', '.', 'value', 'money']",good . value money
Ishaan,5.0 out of 5 stars,Enjoying,Beige,26 October 2025,Satisfied,5.0,2025-10-26,no,enjoying,['enjoying'],1,['enjoying'],1,['enjoying'],['enjoying'],enjoying
Very nice phone case,5.0 out of 5 stars,Good watch,Smoke,25 October 2025,Good,5.0,2025-10-25,so,good watch,"['good', 'watch']",2,['good watch'],1,"['good', 'watch']","['good', 'watch']",good watch
shaurya   jain,4.0 out of 5 stars,Appealing designSuperb lookGreat feelOnly problem i faced was pairing the app and watch but it happened finally after 1-2 resets of the watch,Teal_RoseGold,19 July 2025,Amazing product,4.0,2025-07-19,en,appealing designsuperb lookgreat feelonly problem i faced was pairing the app and watch but it happened finally after 12 resets of the watch,"['appealing', 'designsuperb', 'lookgreat', 'feelonly', 'problem', 'i', 'faced', 'was', 'pairing', 'the', 'app', 'and', 'watch', 'but', 'it', 'happened', 'finally', 'after', '12', 'resets', 'of', 'the', 'watch']",23,['appealing designsuperb lookgreat feelonly problem i faced was pairing the app and watch but it happened finally after 12 resets of the watch'],1,"['appealing', 'designsuperb', 'lookgreat', 'feelonly', 'problem', 'faced', 'pairing', 'app', 'watch', 'happened', 'finally', '12', 'resets', 'watch']","['appealing', 'designsuperb', 'lookgreat', 'feelonly', 'problem', 'faced', 'pairing', 'app', 'watch', 'happened', 'finally', '12', 'reset', 'watch']",appealing designsuperb lookgreat feelonly problem faced pairing app watch happened finally 12 reset watch
Product Edges Not Perfect Fiting..Finishing Also Not Worth..,5.0 out of 5 stars,Worth,Carbon Black,24 October 2025,Value of money,5.0,2025-10-24,en,worth,['worth'],1,['worth'],1,['worth'],['worth'],worth
amrish kumar,4.0 out of 5 stars,Its a good watch in this price. Excellent design and very easy to use. I haven't faced any charging issues yet with this watch. Its touch quality is smooth too. Good one to buy in this price range.,Dark Teal,10 July 2025,Good watch,4.0,2025-07-10,en,its a good watch in this price. excellent design and very easy to use. i havent faced any charging issues yet with this watch. its touch quality is smooth too. good one to buy in this price range.,"['its', 'a', 'good', 'watch', 'in', 'this', 'price', '.', 'excellent', 'design', 'and', 'very', 'easy', 'to', 'use', '.', 'i', 'havent', 'faced', 'any', 'charging', 'issues', 'yet', 'with', 'this', 'watch', '.', 'its', 'touch', 'quality', 'is', 'smooth', 'too', '.', 'good', 'one', 'to', 'buy', 'in', 'this', 'price', 'range', '.']",43,"['its a good watch in this price.', 'excellent design and very easy to use.', 'i havent faced any charging issues yet with this watch.', 'its touch quality is smooth too.', 'good one to buy in this price range.']",5,"['good', 'watch', 'price', '.', 'excellent', 'design', 'easy', 'use', '.', 'havent', 'faced', 'charging', 'issues', 'yet', 'watch', '.', 'touch', 'quality', 'smooth', '.', 'good', 'one', 'buy', 'price', 'range', '.']","['good', 'watch', 'price', '.', 'excellent', 'design', 'easy', 'use', '.', 'havent', 'faced', 'charging', 'issue', 'yet', 'watch', '.', 'touch', 'quality', 'smooth', '.', 'good', 'one', 'buy', 'price', 'range', '.']",good watch price . excellent design easy use . havent faced charging issue yet watch . touch quality smooth . good one buy price range .
ambedkar pradhan,5.0 out of 5 stars,Excellent,Black Mesh,22 October 2025,Excellent,5.0,2025-10-22,ca,excellent,['excellent'],1,['excellent'],1,['excellent'],['excellent'],excellent
jitendra uchil,5.0 out of 5 stars,"As per my expectations,",Silver,29 October 2025,Good choice,5.0,2025-10-29,en,"as per my expectations,","['as', 'per', 'my', 'expectations', ',']",5,"['as per my expectations,']",1,"['per', 'expectations', ',']","['per', 'expectation', ',']","per expectation ,"
Suresh G,5.0 out of 5 stars,"Battery goodPower saving mode goodGPS not availableIn metal strap more waitIn packing to be add the Silicon StrapHeart rate, SpO2 not working properly",Black_Metal,9 October 2025,Product is good,5.0,2025-10-09,en,"battery goodpower saving mode goodgps not availablein metal strap more waitin packing to be add the silicon strapheart rate, spo2 not working properly","['battery', 'goodpower', 'saving', 'mode', 'goodgps', 'not', 'availablein', 'metal', 'strap', 'more', 'waitin', 'packing', 'to', 'be', 'add', 'the', 'silicon', 'strapheart', 'rate', ',', 'spo2', 'not', 'working', 'properly']",24,"['battery goodpower saving mode goodgps not availablein metal strap more waitin packing to be add the silicon strapheart rate, spo2 not working properly']",1,"['battery', 'goodpower', 'saving', 'mode', 'goodgps', 'availablein', 'metal', 'strap', 'waitin', 'packing', 'add', 'silicon', 'strapheart', 'rate', ',', 'spo2', 'working', 'properly']","['battery', 'goodpower', 'saving', 'mode', 'goodgps', 'availablein', 'metal', 'strap', 'waitin', 'packing', 'add', 'silicon', 'strapheart', 'rate', ',', 'spo2', 'working', 'properly']","battery goodpower saving mode goodgps availablein metal strap waitin packing add silicon strapheart rate , spo2 working properly"
vijay,4.0 out of 5 stars,Is watch don't have msg tracking like whats up and normal  msgs,Carbon Black,20 July 2025,Msgs,4.0,2025-07-20,en,is watch dont have msg tracking like whats up and normal msgs,"['is', 'watch', 'dont', 'have', 'msg', 'tracking', 'like', 'whats', 'up', 'and', 'normal', 'msgs']",12,['is watch dont have msg tracking like whats up and normal msgs'],1,"['watch', 'dont', 'msg', 'tracking', 'like', 'whats', 'normal', 'msgs']","['watch', 'dont', 'msg', 'tracking', 'like', 'whats', 'normal', 'msg']",watch dont msg tracking like whats normal msg
