name,rating,review,colour,date,title,rating_score,date_parsed,language,cleaned_text,tokens,token_count,sentences,sentence_count,tokens_no_stopwords,lemmatized_tokens,lemmatized_text
Manighandan007,5.0 out of 5 stars,"The silver design is sleek and the battery life is impressive. It offers the typical features of most smartwatches, including alarm, step tracking and goal-setting for walking. However, like all smartwatches, it’s not 100% accurate in step counting—it adds steps while traveling on metro, buses, or bikes. Overall, it does the job, has a solid build, and even survived in heavy rain.",Silver,21 September 2025,Great battery backup,5.0,2025-09-21,en,"the silver design is sleek and the battery life is impressive. it offers the typical features of most smartwatches, including alarm, step tracking and goalsetting for walking. however, like all smartwatches, its not 100 accurate in step countingit adds steps while traveling on metro, buses, or bikes. overall, it does the job, has a solid build, and even survived in heavy rain.","['the', 'silver', 'design', 'is', 'sleek', 'and', 'the', 'battery', 'life', 'is', 'impressive', '.', 'it', 'offers', 'the', 'typical', 'features', 'of', 'most', 'smartwatches', ',', 'including', 'alarm', ',', 'step', 'tracking', 'and', 'goalsetting', 'for', 'walking', '.', 'however', ',', 'like', 'all', 'smartwatches', ',', 'its', 'not', '100', 'accurate', 'in', 'step', 'countingit', 'adds', 'steps', 'while', 'traveling', 'on', 'metro', ',', 'buses', ',', 'or', 'bikes', '.', 'overall', ',', 'it', 'does', 'the', 'job', ',', 'has', 'a', 'solid', 'build', ',', 'and', 'even', 'survived', 'in', 'heavy', 'rain', '.']",75,"['the silver design is sleek and the battery life is impressive.', 'it offers the typical features of most smartwatches, including alarm, step tracking and goalsetting for walking.', 'however, like all smartwatches, its not 100 accurate in step countingit adds steps while traveling on metro, buses, or bikes.', 'overall, it does the job, has a solid build, and even survived in heavy rain.']",4,"['silver', 'design', 'sleek', 'battery', 'life', 'impressive', '.', 'offers', 'typical', 'features', 'smartwatches', ',', 'including', 'alarm', ',', 'step', 'tracking', 'goalsetting', 'walking', '.', 'however', ',', 'like', 'smartwatches', ',', '100', 'accurate', 'step', 'countingit', 'adds', 'steps', 'traveling', 'metro', ',', 'buses', ',', 'bikes', '.', 'overall', ',', 'job', ',', 'solid', 'build', ',', 'even', 'survived', 'heavy', 'rain', '.']","['silver', 'design', 'sleek', 'battery', 'life', 'impressive', '.', 'offer', 'typical', 'feature', 'smartwatches', ',', 'including', 'alarm', ',', 'step', 'tracking', 'goalsetting', 'walking', '.', 'however', ',', 'like', 'smartwatches', ',', '100', 'accurate', 'step', 'countingit', 'add', 'step', 'traveling', 'metro', ',', 'bus', ',', 'bike', '.', 'overall', ',', 'job', ',', 'solid', 'build', ',', 'even', 'survived', 'heavy', 'rain', '.']","silver design sleek battery life impressive . offer typical feature smartwatches , including alarm , step tracking goalsetting walking . however , like smartwatches , 100 accurate step countingit add step traveling metro , bus , bike . overall , job , solid build , even survived heavy rain ."
B.Narayana,4.0 out of 5 stars,Fine. But I wanted item with belt,Rose Gold Mesh,23 July 2025,Good,4.0,2025-07-23,en,fine. but i wanted item with belt,"['fine', '.', 'but', 'i', 'wanted', 'item', 'with', 'belt']",8,"['fine.', 'but i wanted item with belt']",2,"['fine', '.', 'wanted', 'item', 'belt']","['fine', '.', 'wanted', 'item', 'belt']",fine . wanted item belt
Saurabh Swami,5.0 out of 5 stars,Very good watch worth buying,Rose Gold Mesh,16 October 2025,Beautiful watch,5.0,2025-10-16,en,very good watch worth buying,"['very', 'good', 'watch', 'worth', 'buying']",5,['very good watch worth buying'],1,"['good', 'watch', 'worth', 'buying']","['good', 'watch', 'worth', 'buying']",good watch worth buying
Ishu,5.0 out of 5 stars,Nice product,Wine_Red,17 October 2025,Nice,5.0,2025-10-17,ro,nice product,"['nice', 'product']",2,['nice product'],1,"['nice', 'product']","['nice', 'product']",nice product
Amazon User,5.0 out of 5 stars,Nice product. Value for money. Best brand in smart watches.,Jet Black,10 October 2025,Value for money.,5.0,2025-10-10,en,nice product. value for money. best brand in smart watches.,"['nice', 'product', '.', 'value', 'for', 'money', '.', 'best', 'brand', 'in', 'smart', 'watches', '.']",13,"['nice product.', 'value for money.', 'best brand in smart watches.']",3,"['nice', 'product', '.', 'value', 'money', '.', 'best', 'brand', 'smart', 'watches', '.']","['nice', 'product', '.', 'value', 'money', '.', 'best', 'brand', 'smart', 'watch', '.']",nice product . value money . best brand smart watch .
Karthikeyan Nadadur,4.0 out of 5 stars,Chrger wire jas problem,Rose Gold,22 July 2025,Charger wire hs problem,4.0,2025-07-22,en,chrger wire jas problem,"['chrger', 'wire', 'jas', 'problem']",4,['chrger wire jas problem'],1,"['chrger', 'wire', 'jas', 'problem']","['chrger', 'wire', 'jas', 'problem']",chrger wire jas problem
Joyanta Kumar Das,5.0 out of 5 stars,Very nice watch. After long time the colours on metals are as shinny as new,Rose Gold Mesh,5 October 2025,Fastrack is best,5.0,2025-10-05,en,very nice watch. after long time the colours on metals are as shinny as new,"['very', 'nice', 'watch', '.', 'after', 'long', 'time', 'the', 'colours', 'on', 'metals', 'are', 'as', 'shinny', 'as', 'new']",16,"['very nice watch.', 'after long time the colours on metals are as shinny as new']",2,"['nice', 'watch', '.', 'long', 'time', 'colours', 'metals', 'shinny', 'new']","['nice', 'watch', '.', 'long', 'time', 'colour', 'metal', 'shinny', 'new']",nice watch . long time colour metal shinny new
abhey singh,3.0 out of 5 stars,Why did you pick this product vs others?:Watch is good and ok.But box I received it in was not sealed.seal was already broken.Although watch is new only so I accepted and did not raise any issue regarding product as I was in mumbai for that day only..No damage was found.It hurts little bit to know that same watch may have been sent to someone first and then they sent the same one to me when that person returned it back.,BLACK,10 July 2025,Broken seal,3.0,2025-07-10,en,why did you pick this product vs others?watch is good and ok.but box i received it in was not sealed.seal was already broken.although watch is new only so i accepted and did not raise any issue regarding product as i was in mumbai for that day only..no damage was found.it hurts little bit to know that same watch may have been sent to someone first and then they sent the same one to me when that person returned it back.,"['why', 'did', 'you', 'pick', 'this', 'product', 'vs', 'others', '?', 'watch', 'is', 'good', 'and', 'ok.but', 'box', 'i', 'received', 'it', 'in', 'was', 'not', 'sealed.seal', 'was', 'already', 'broken.although', 'watch', 'is', 'new', 'only', 'so', 'i', 'accepted', 'and', 'did', 'not', 'raise', 'any', 'issue', 'regarding', 'product', 'as', 'i', 'was', 'in', 'mumbai', 'for', 'that', 'day', 'only', '..', 'no', 'damage', 'was', 'found.it', 'hurts', 'little', 'bit', 'to', 'know', 'that', 'same', 'watch', 'may', 'have', 'been', 'sent', 'to', 'someone', 'first', 'and', 'then', 'they', 'sent', 'the', 'same', 'one', 'to', 'me', 'when', 'that', 'person', 'returned', 'it', 'back', '.']",85,['why did you pick this product vs others?watch is good and ok.but box i received it in was not sealed.seal was already broken.although watch is new only so i accepted and did not raise any issue regarding product as i was in mumbai for that day only..no damage was found.it hurts little bit to know that same watch may have been sent to someone first and then they sent the same one to me when that person returned it back.'],1,"['pick', 'product', 'vs', 'others', '?', 'watch', 'good', 'ok.but', 'box', 'received', 'sealed.seal', 'already', 'broken.although', 'watch', 'new', 'accepted', 'raise', 'issue', 'regarding', 'product', 'mumbai', 'day', '..', 'damage', 'found.it', 'hurts', 'little', 'bit', 'know', 'watch', 'may', 'sent', 'someone', 'first', 'sent', 'one', 'person', 'returned', 'back', '.']","['pick', 'product', 'v', 'others', '?', 'watch', 'good', 'ok.but', 'box', 'received', 'sealed.seal', 'already', 'broken.although', 'watch', 'new', 'accepted', 'raise', 'issue', 'regarding', 'product', 'mumbai', 'day', '..', 'damage', 'found.it', 'hurt', 'little', 'bit', 'know', 'watch', 'may', 'sent', 'someone', 'first', 'sent', 'one', 'person', 'returned', 'back', '.']",pick product v others ? watch good ok.but box received sealed.seal already broken.although watch new accepted raise issue regarding product mumbai day .. damage found.it hurt little bit know watch may sent someone first sent one person returned back .
Vishalkurkure,4.0 out of 5 stars,watch is comfortable good quality and colour,BLUE,17 July 2025,Good,4.0,2025-07-17,en,watch is comfortable good quality and colour,"['watch', 'is', 'comfortable', 'good', 'quality', 'and', 'colour']",7,['watch is comfortable good quality and colour'],1,"['watch', 'comfortable', 'good', 'quality', 'colour']","['watch', 'comfortable', 'good', 'quality', 'colour']",watch comfortable good quality colour
Sumit Swami,5.0 out of 5 stars,Very Good Stylish Watch,Black_Metal,12 October 2025,Super,5.0,2025-10-12,en,very good stylish watch,"['very', 'good', 'stylish', 'watch']",4,['very good stylish watch'],1,"['good', 'stylish', 'watch']","['good', 'stylish', 'watch']",good stylish watch
Babita,5.0 out of 5 stars,Very nice 👍,Wine Red,12 October 2025,Quality and colour very good 👍♥️♥️,5.0,2025-10-12,cs,very nice,"['very', 'nice']",2,['very nice'],1,['nice'],['nice'],nice
SYED ABDUL JAMAAL,5.0 out of 5 stars,It's a very good product 😊,Silver Metal,9 October 2025,Very good product,5.0,2025-10-09,en,its a very good product,"['its', 'a', 'very', 'good', 'product']",5,['its a very good product'],1,"['good', 'product']","['good', 'product']",good product
Jaiswal parwati,5.0 out of 5 stars,Very very very nice,Black_Metal,11 October 2025,Bhot achcha,5.0,2025-10-11,cs,very very very nice,"['very', 'very', 'very', 'nice']",4,['very very very nice'],1,['nice'],['nice'],nice
